nom,departement,numero_dep,categorie,resume,histoire,latitude,longitude,adresse,baignade,toilettes,restaurant,photo
La légende de St Efflam,Côte d’Armor & Ille-et-Villaine,2235,Créatures Fantastiques,La légende de St Efflam,"De nombreuses légendes tournent autour du grand rocher mais la plus connue est celle de St Efflam. Efflam est l’unique fils d’un chef de clan né au Vème siècle. Malgré sa volonté de devenir moine, il fut fiancé à Enora, la fille d’un roi d’Irlande. Cependant, lors de la nuit de noces, il embarqua pour l’Armorique pour y fonder un ermitage. Une fois arrivé, il tomba nez à nez avec le roi Arthur, en plein combat avec un énorme dragon. Constatant qu’Arthur ne parvenait pas à venir à bout de cette bête, il s’empressa de faire jaillir une source de son bâton afin de le désaltérer et décida lui-même de s’occuper du dragon. Il lui ordonna, au nom du Christ, de se montrer. La bête obéit et surgit du grand rocher avant de disparaître en mer sans laisser de traces. Suite à cet évenement, Efflam s’installa au pied du grand rocher et invita sa femme Enora à le rejoindre. Les deux époux passèrent le reste de leur vie ensemble, menant une vie de religieux.",48.67170787540873,-3.588713159294999,22310 Plestin-les-Grèves,FALSE,FALSE,FALSE,https://www.lieux-insolites.fr/cotedarmor/rocher/rocher.htm
La légende de St Efflam,Côte d’Armor & Ille-et-Villaine,2235,Histoires Maritimes,La légende de St Efflam,"De nombreuses légendes tournent autour du grand rocher mais la plus connue est celle de St Efflam. Efflam est l’unique fils d’un chef de clan né au Vème siècle. Malgré sa volonté de devenir moine, il fut fiancé à Enora, la fille d’un roi d’Irlande. Cependant, lors de la nuit de noces, il embarqua pour l’Armorique pour y fonder un ermitage. Une fois arrivé, il tomba nez à nez avec le roi Arthur, en plein combat avec un énorme dragon. Constatant qu’Arthur ne parvenait pas à venir à bout de cette bête, il s’empressa de faire jaillir une source de son bâton afin de le désaltérer et décida lui-même de s’occuper du dragon. Il lui ordonna, au nom du Christ, de se montrer. La bête obéit et surgit du grand rocher avant de disparaître en mer sans laisser de traces. Suite à cet évenement, Efflam s’installa au pied du grand rocher et invita sa femme Enora à le rejoindre. Les deux époux passèrent le reste de leur vie ensemble, menant une vie de religieux.",48.67170787540873,-3.588713159294999,22310 Plestin-les-Grèves,FALSE,FALSE,FALSE,https://www.lieux-insolites.fr/cotedarmor/rocher/rocher.htm
Le naufrage du Grand Rocher,Côte d’Armor & Ille-et-Villaine,2235,Histoires Maritimes,Le naufrage du Grand Rocher,"Cette légende raconte que lors d’une nuit de brouillard, un bateau fit naufrage. Bien que l’équipage et les passagers étaient tous presque sûrs de mourir, une mère de famille implora Notre Dame de Bon Secours de les sauver. Aussitôt, une lumière éclatante est apparue. On dit que c’est la Vierge qui aurait ordonné aux Roc’h Karlés situé dans les collines de venir au secours des naufragés pour grimper sur les flancs et échapper aux flots déchaînés. ",48.67170787540873,-3.588713159294999,22310 Plestin-les-Grèves,FALSE,FALSE,FALSE,https://www.lieux-insolites.fr/cotedarmor/rocher/rocher.htm
Le naufrage du Grand Rocher,Côte d’Armor & Ille-et-Villaine,2235,Croyances Religion,Le naufrage du Grand Rocher,"Cette légende raconte que lors d’une nuit de brouillard, un bateau fit naufrage. Bien que l’équipage et les passagers étaient tous presque sûrs de mourir, une mère de famille implora Notre Dame de Bon Secours de les sauver. Aussitôt, une lumière éclatante est apparue. On dit que c’est la Vierge qui aurait ordonné aux Roc’h Karlés situé dans les collines de venir au secours des naufragés pour grimper sur les flancs et échapper aux flots déchaînés. ",48.67170787540873,-3.588713159294999,22310 Plestin-les-Grèves,FALSE,FALSE,FALSE,https://www.lieux-insolites.fr/cotedarmor/rocher/rocher.htm
Guénolé de Landévennec,Côte d’Armor & Ille-et-Villaine,2235,Croyances Religion,Guénolé de Landévennec,"Guénolé était un Saint chargé de protéger l'Île de Sein, qui s’appelait à l’époque Insula Seidhun et ses habitants des injonctions et des belles paroles envoyées par le Diable. Il faisait souvent le trajet entre l’Abbaye de Landevennec et l’Ile et s’arrêtait souvent faire une pause au Bec du Raz pour contempler sa cité. Il envisageait de construire un pont entre le bec et l’Ile afin que les habitants puissent voyager plus facilement et sans danger lorsque le temps était mauvais. Un jour, alors que Guénolé contemplait le paysage, un bel homme s’approcha de lui. Le Saint reconnu immédiatement à son ton mielleux et ses pieds fourchus que devant lui se tenait le Diable en personne.  

“Que me veux-tu, Polig ? (Petit Paul, surnom du diable)
— Je veux aller sur l’île qui est au loin là-bas.
— Par ma crosse, tu ne passeras pas.
— J’ai ouï dire que tu envisages de construire un pont, et tu ne pourras pas m’empêcher de l’emprunter lorsqu’il sera construit.
— Alors je ne construirai pas de pont.
— Dans ce cas là, tu seras parjure car tu as donné ta parole. Tu perdras ta sainteté et tu deviendras vite mon disciple car le mensonge aura raison de toi.”

Guénolé était dans une impasse. La construction du pont entraînerait la venue du Diable et par conséquent la perte des âmes qui peuplaient l'Île. Mais si le Saint renonçait à construire ce pont, il deviendrait un menteur aux yeux des habitants.

Mais Dieu veillait, et les prières de Guénolé furent entendues. Ayant pitié de son pasteur, il lui offrit un miracle. Grâce à la protection divine, le Saint établit un pont de glace entre l'Île de Sein et le Bec du Raz, sachant pertinemment que le Diable ne tarderait pas à arriver. Ce dernier se montra effectivement très rapidement, persuadé de sa victoire, ne pouvant attendre de corrompre les âmes innocentes des Iliens. Mais alors qu’il se précipitait sur le pont, ses sabots brûlants firent fondre la glace, l’entrainant ainsi au bas de la falaise que l’on nomme aujourd’hui “la cheminée du Diable”. Loin de reconnaître sa défaite, le Diable tenta de prendre le bateau pour revenir sur l'île. Mais ses sabots incandescents l'empêchaient à nouveau d’atteindre son but, brûlant les navires de bois avant qu’ils n’arrivent au port. 

Constatant que le Diable n’abandonnait pas, Guénolé usa de nouveau de sa protection divine pour augmenter la force des courants, rendant ainsi son périple parmi les flots encore plus difficile et éleva la chaleur de ses sabots pour qu’aucune chaussure ou autre protection ne puisse protéger les bateaux de ses pieds bouillants.",48.287796426127905,-4.268813314921281,"Rue Gorrequer, 29560 Landévennec",FALSE,FALSE,FALSE,
La Baie des Trépassés,Finistère,29,Histoires Maritimes,Une plage macabre qui effraie les marins de toute la Bretagne ... ,,48.04805556,4.71472222,Cléden-Cap-Sizun 29770,TRUE,FALSE,TRUE,https://fr.wikipedia.org/wiki/Baie_des_Tr%C3%A9pass%C3%A9s#/media/Fichier:Baie_des_Tr%C3%A9pass%C3%A9s.jpg
La ville d'Ys,Finistère,29,Histoires Maritimes,La ville légendaire Bretonne engloutie par l'Océan surgira-t-elle à nouveau ...,,48.093228,-4.328619,Douarnenez 29100,TRUE,TRUE,TRUE,https://i.pinimg.com/originals/eb/3d/1f/eb3d1f1b45e3fbf1a407bc1df69940bc.jpg
Mona au royaume des morgans,Finistère,29,Créatures Fantastiques,"Une jeune fille d'une grande beauté se fait enlever par les morgans, peuple de la mer",,48.4598,-5.0863,Ouessant 29242,TRUE,TRUE,TRUE,https://api.brest-terres-oceanes.fr/sites/default/files/articles-pictures/ouessant_pointe_de_pern_vignette_crtb-ac6292_job-nicolas_0.jpg
Le géant du Cap de la Chèvre,Finistère,29,Créatures Fantastiques,Quand le géant Kawr rencontre les korrigans ...,,48.23333333,4.56666667,Crozon 29160,FALSE,FALSE,FALSE,https://upload.wikimedia.org/wikipedia/commons/thumb/9/96/051_La_Pointe_de_Dinan.JPG/800px-051_La_Pointe_de_Dinan.JPG
La légende d'Azénor,Finistère,29,Histoires Maritimes,"Le tragique destin de la comtesse Azénor, victime d'injustice",,48.381389,4.494722,"6 Boulevard Jean Moulin, 29200 Brest",FALSE,FALSE,FALSE,https://www.brest.fr/fileadmin/_processed_/7/c/csm_chateau_jyg_ts22678_609acd8dc4.jpg
La légende des Korrigans,Finistère,29,Créatures Fantastiques,Des petits gnomes riches et malicieux,,48.25475440970997,-4.432193131371162,29160 Crozon,FALSE,FALSE,FALSE,https://littleweekends.fr/wp-content/uploads/2020/03/Croque-Ile-Vierge-Crozon.jpg
Les légendes du Cap Sizun,Finistère,29,Créatures Fantastiques,"Les korrigans, lutins et sirènes du Cap Sizun",,48.09296552491043,-4.519823296691359,29790 Beuzec Cap Sizun,FALSE,FALSE,FALSE,https://www.google.com/url?sa=i&url=https%3A%2F%2Ffr.wikipedia.org%2Fwiki%2FCap_Sizun&psig=AOvVaw3UkHVTaR8B0pu4WoiEVA1a&ust=1611434061993000&source=images&cd=vfe&ved=0CAIQjRxqFwoTCLDXodaxsO4CFQAAAAAdAAAAABAS
Les légendes du Cap Sizun,Finistère,29,Croyances Religion,Des sorcières impitoyables...,,48.09296552491043,-4.519823296691360,29791 Beuzec Cap Sizun,FALSE,FALSE,FALSE,https://www.google.com/url?sa=i&url=https%3A%2F%2Ffr.wikipedia.org%2Fwiki%2FCap_Sizun&psig=AOvVaw3UkHVTaR8B0pu4WoiEVA1a&ust=1611434061993000&source=images&cd=vfe&ved=0CAIQjRxqFwoTCLDXodaxsO4CFQAAAAAdAAAAABAS
La pointe du Raz,Finistère,29,Histoires Maritimes,Un océan maudit...,,48.04087661696681,-4.7408242693698135,29770 Plogoff,FALSE,FALSE,FALSE,https://www.google.com/url?sa=i&url=https%3A%2F%2Fwww.tripadvisor.fr%2FAttraction_Review-g1383419-d1381276-Reviews-Pointe_du_Raz-Plogoff_Finistere_Brittany.html&psig=AOvVaw2DCtSzZ-k7Lotciwdl_a5G&ust=1611435420731000&source=images&cd=vfe&ved=0CAIQjRxqFwoTCPCO-uK2sO4CFQAAAAAdAAAAABAK
La Pointe de Saint-Mathieu,Finistère,29,Histoires Maritimes,Le miracle du naufrage ,,48.331673026695306,-4.7734866232475515,29217 Plougonvelin,FALSE,FALSE,FALSE,https://www.google.com/url?sa=i&url=https%3A%2F%2Fwww.tourismebretagne.com%2Foffres%2Fhostellerie-de-la-pointe-saint-mathieu-plougonvelin-fr-1990740%2F&psig=AOvVaw2_5R8LsKFBSofX13YpMg1R&ust=1611435330559000&source=images&cd=vfe&ved=0CAIQjRxqFwoTCPCZp7e2sO4CFQAAAAAdAAAAABAD
Cairn de Barnenez,Finistère,29,Créatures Fantastiques,"Cairn, demeure des korrigans",,48.66772032004395,-3.8583127869139626,"Cairn de Barnénez, 29252 Plouezoc'h",FALSE,FALSE,FALSE,https://www.google.com/url?sa=i&url=https%3A%2F%2F29.kidiklik.fr%2Fbouger-famille%2F3773-balade-famille-cairn-de-barnenez-plouezoch.html&psig=AOvVaw2ie0vt0awSkXOXGrDsy48l&ust=1611436095042000&source=images&cd=vfe&ved=0CAIQjRxqFwoTCKiU9bO5sO4CFQAAAAAdAAAAABAD
La fée de l'ile du Loc'h,Finistère,29,Créatures Fantastiques,Une fée qui finalement n'en est pas une,,47.706312413968284,-3.995927778070277,Fouesnant,FALSE,FALSE,FALSE,https://www.google.com/url?sa=i&url=https%3A%2F%2Fwww.letelegramme.fr%2Ffinistere%2Ffouesnant%2File-du-loc-h-l-avenir-de-l-archipel-des-glenan-23-08-2017-11637839.php&psig=AOvVaw2eMhP9lwS4foFQ-GtSrhXQ&ust=1611436201907000&source=images&cd=vfe&ved=0CAIQjRxqFwoTCPCQuNO5sO4CFQAAAAAdAAAAABAQ
Le dragon de l'ile de Batz,Finistère,29,Créatures Fantastiques,La légende a fait de ce rocher le lieu où Saint Pol aurait précipité dans la mer le dragon qui terrorisait l'ile,,48.748446385263726,-4.015452942083586,29253 Île-de-Batz,FALSE,FALSE,FALSE,https://live.staticflickr.com/65535/48695614402_8057b4fe55_o.jpg
Le phare de Tévennec,Finistère,29,Histoires Maritimes,Un phare qui causerait de la folie et des naufrages chez les marins qui s'en approchent,,48.07152977555185,-4.795290730760175,FALSE,FALSE,FALSE,https://www.google.com/url?sa=i&url=https%3A%2F%2Ffigaronautisme.meteoconsult.fr%2Factus-nautisme-escales%2F2019-10-21%2F52727-le-phare-de-tevennec-alias-les-portes-de-l-enfer&psig=AOvVaw1r6xe902vsIXS1i-sMszgy&ust=1611436588649000&source=images&cd=vfe&ved=0CAIQjRxqFwoTCLC74Yq7sO4CFQAAAAAdAAAAABAk
Les pilleurs d'épave de Ménéham,Finistère,29,Histoires Maritimes,"Les paganiz, des êtres pilleurs et meutriers",,48.668228105504234,-4.371160961117763,29890 Kerlouan,FALSE,FALSE,FALSE,https://www.brest-terres-oceanes.fr/wp-content/uploads/2018/06/Le-poste-de-garde-du-village-de-Meneham-%C2%A9-BERTHIER-Emmanuel-1920x920.jpg
L'ile aux moines,Morbihan,56,Croyances Religion,Un amour impossible...,,47.59750000,2.84333333,56780 Île-aux-Moines,TRUE,TRUE,TRUE,https://www.iles-du-ponant.com/wp-content/uploads/moine/Ile-aux-moines-3-2000x850.jpg
La légende de l'ile d'Houat,Morbihan,56,Créatures Fantastiques,"Houat, entre légende et histoire vraie...",,47.391609919439155,-2.966795321452023,"Île-d'Houat, 56170",TRUE,TRUE,TRUE,https://lh3.googleusercontent.com/proxy/njOogKqHoR_KSoKvDyOnSM6zz2UBlNv5X8IuimONOX2FlO3KLabYW_LYuzgQn5eb_qZmyvp5AnwG-Xhxrs90XKiwi7CjpZIpjtGxNW5DOEk
Les alignements de Carnac,Morbihan,56,Croyances Religion,La légende de St Cornély,,47.593301745582416,-3.0825425,"LIeu-dit le Ménec, 56340 Carnac",FALSE,TRUE,TRUE,https://www.lepelerin.com/wp-content/uploads/2019/02/A-Carnac-nom-d-un-menhir-e1558610666135.jpg
Les alignements de Carnac,Morbihan,56,Créatures Fantastiques,La légende de St Cornély,,47.593301745582416,-3.0825425,"LIeu-dit le Ménec, 56340 Carnac",FALSE,TRUE,TRUE,https://www.lepelerin.com/wp-content/uploads/2019/02/A-Carnac-nom-d-un-menhir-e1558610666135.jpg
l'île du Golfe,Morbihan,56,Créatures Fantastiques,La légende de l'île du Golfe,,47.593301745582416,-3.0825425,"LIeu-dit le Ménec, 56340 Carnac",FALSE,TRUE,TRUE,https://www.lepelerin.com/wp-content/uploads/2019/02/A-Carnac-nom-d-un-menhir-e1558610666135.jpg
l'île du Golfe,Morbihan,56,Histoires Maritimes,La légende de l'île du Golfe,,47.56820889537029,-2.769526519302257,Golfe du Morbihan,TRUE,TRUE,TRUE,https://www.baiedequiberon.bzh/sites/default/files/styles/slide_xl/public/2019-04/golfe_du_morbihan-vue_aerienne-crtb-ad5488_lamoureux-alexandre.jpg?h=39a93345&itok=D7kDMj6k
la légende des korrigans,Morbihan,56,Créatures Fantastiques,Les korrigans,,47.59450638437026,-3.0825334861674043,Carnac,FALSE,FALSE,FALSE,https://www.ot-carnac.fr/decouvrir/menhirs-et-patrimoine/comprendre-le-megalithisme/legendes